[
  {
    "id": "N1",
    "name": "Smartphone",
    "tags": [
      "electronics",
      "mobile",
      "consumer tech",
      "communication device",
      "computing platform",
      "sensor hub",
      "consumer electronics",
      "telecommunications",
      "digital services"
    ],
    "layer": "Product",
    "category": "Product",
    "description": "Portable multifunctional computing and communication device.",
    "longDescription": "A smartphone integrates telecommunication, computing, sensing, and application execution into a handheld device, enabling digital communication, media consumption, and productivity applications.",
    "chronology": {
      "summary": "Emerged from convergence of mobile phones and PDAs.",
      "events": [
        {
          "year": 2007,
          "event": "Modern smartphone paradigm established",
          "context": "Touchscreen-based smartphone architectures became dominant."
        }
      ]
    },
    "relationships": [
      {
        "relationshipFamily": "VALUE_CHAIN",
        "relationshipType": "Consumes",
        "targetNodeId": "N2",
        "description": "Relies on battery assembly process for energy storage systems."
      }
    ],
    "specific": {
      "materiality": "electronic device with semiconductor components",
      "useCase": "personal communication and computing",
      "lifeCycleStage": "consumption"
    },
    "metadata": {
      "inheritanceLevel": 0,
      "confidenceScore": 0.95,
      "sourceReference": "industrial systems synthesis",
      "createdAt": "2026-06-06T10:00:00Z",
      "auditTrail": [
        {
          "reviewDate": "2026-06-06",
          "reviewNote": "Initial dataset entry created"
        }
      ]
    },
    "references": [
      {
        "title": "Mobile Computing Systems Overview",
        "link": "https://example.org/mobile-systems",
        "description": "Overview of smartphone system architectures."
      }
    ]
  },
  {
    "id": "N2",
    "name": "Lithium Battery Assembly",
    "tags": [
      "battery",
      "manufacturing",
      "energy",
      "energy storage production",
      "component fabrication",
      "battery manufacturing",
      "electronics supply chain"
    ],
    "layer": "Production",
    "category": "Production Process",
    "description": "Manufacturing process for assembling lithium-ion battery cells.",
    "longDescription": "A multi-stage electrochemical assembly process involving electrode preparation, cell stacking, electrolyte filling, and sealing under controlled conditions.",
    "chronology": {
      "summary": "Evolved with demand for portable electronics and EVs.",
      "events": [
        {
          "year": 1991,
          "event": "Commercial lithium-ion batteries introduced",
          "context": "Sony commercialized lithium-ion technology."
        }
      ]
    },
    "relationships": [
      {
        "relationshipFamily": "FUNCTIONAL",
        "relationshipType": "Transforms",
        "targetNodeId": "N1",
        "description": "Provides energy storage components for smartphones."
      }
    ],
    "specific": {
      "inputs": [
        "lithium compounds",
        "cathode materials",
        "anode materials",
        "electrolyte"
      ],
      "outputs": [
        "battery cells"
      ],
      "transformationLogic": "electrochemical energy storage assembly under controlled environment"
    },
    "metadata": {
      "inheritanceLevel": 1,
      "confidenceScore": 0.9,
      "sourceReference": "industrial battery engineering literature",
      "createdAt": "2026-06-06T10:05:00Z",
      "auditTrail": [
        {
          "reviewDate": "2026-06-06",
          "reviewNote": "Validated process structure"
        }
      ]
    },
    "references": [
      {
        "title": "Lithium-Ion Manufacturing Processes",
        "link": "https://example.org/battery-manufacturing",
        "description": "Technical overview of battery assembly."
      }
    ]
  },
  {
    "id": "N3",
    "name": "Surface Mount Technology (SMT)",
    "tags": [
      "electronics",
      "manufacturing technique",
      "electronics assembly",
      "miniaturization enablement",
      "electronics manufacturing",
      "PCB production"
    ],
    "layer": "Technical",
    "category": "Technique",
    "description": "Technique for mounting electronic components directly onto PCB surfaces.",
    "longDescription": "SMT is a highly automated electronics assembly technique enabling miniaturization and high-density circuit design through pick-and-place machines and reflow soldering.",
    "chronology": {
      "summary": "Replaced through-hole assembly in modern electronics.",
      "events": [
        {
          "year": 1980,
          "event": "SMT adoption begins in industry",
          "context": "Driven by demand for smaller electronics."
        }
      ]
    },
    "relationships": [
      {
        "relationshipFamily": "CAPABILITY_DEPENDENCY",
        "relationshipType": "Enables",
        "targetNodeId": "N2",
        "description": "Enables automated battery electronics assembly."
      }
    ],
    "specific": {
      "knowledgeType": "manufacturing engineering knowledge",
      "codificationLevel": "explicit",
      "transferMechanism": "training manuals and machine programming"
    },
    "metadata": {
      "inheritanceLevel": 2,
      "confidenceScore": 0.92,
      "sourceReference": "electronics manufacturing standards",
      "createdAt": "2026-06-06T10:10:00Z",
      "auditTrail": [
        {
          "reviewDate": "2026-06-06",
          "reviewNote": "Technique classification verified"
        }
      ]
    },
    "references": [
      {
        "title": "SMT Process Fundamentals",
        "link": "https://example.org/smt",
        "description": "Explanation of surface mount assembly."
      }
    ]
  },
  {
    "id": "N4",
    "name": "Precision Manufacturing Capability",
    "tags": [
      "precision",
      "manufacturing",
      "capability",
      "quality assurance",
      "high-precision fabrication",
      "advanced manufacturing",
      "aerospace",
      "electronics"
    ],
    "layer": "Production",
    "category": "Production Capability",
    "description": "Organizational capability to manufacture high-tolerance components.",
    "longDescription": "Represents the ability of a production system to achieve micron-level tolerances in fabrication processes using advanced machinery and quality control systems.",
    "chronology": {
      "summary": "Developed alongside CNC machining and semiconductor fabrication.",
      "events": [
        {
          "year": 1970,
          "event": "CNC machining adoption",
          "context": "Enabled repeatable precision manufacturing."
        }
      ]
    },
    "relationships": [
      {
        "relationshipFamily": "CAPABILITY_DEPENDENCY",
        "relationshipType": "Enables",
        "targetNodeId": "N3",
        "description": "Supports SMT component placement precision."
      }
    ],
    "specific": {
      "capabilityType": "manufacturing precision",
      "proficiencyLevel": "high",
      "measurability": "defect rate per million units"
    },
    "metadata": {
      "inheritanceLevel": 2,
      "confidenceScore": 0.93,
      "sourceReference": "industrial engineering frameworks",
      "createdAt": "2026-06-06T10:15:00Z",
      "auditTrail": [
        {
          "reviewDate": "2026-06-06",
          "reviewNote": "Capability validated"
        }
      ]
    },
    "references": [
      {
        "title": "Precision Manufacturing Systems",
        "link": "https://example.org/precision-manufacturing",
        "description": "Study of high-accuracy production systems."
      }
    ]
  },
  {
    "id": "N5",
    "name": "Semiconductor Fab Plant",
    "tags": [
      "semiconductor",
      "infrastructure",
      "fab",
      "chip production",
      "advanced fabrication environment",
      "semiconductors",
      "electronics manufacturing"
    ],
    "layer": "Technical",
    "category": "Technical Infrastructure",
    "description": "Industrial facility for manufacturing semiconductor chips.",
    "longDescription": "A semiconductor fabrication plant is a highly controlled industrial environment used to manufacture integrated circuits using photolithography and chemical processing.",
    "chronology": {
      "summary": "Evolved with the rise of integrated circuits.",
      "events": [
        {
          "year": 1960,
          "event": "First semiconductor fabs established",
          "context": "Enabled mass production of integrated circuits."
        }
      ]
    },
    "relationships": [
      {
        "relationshipFamily": "STRUCTURAL",
        "relationshipType": "Enables",
        "targetNodeId": "N3",
        "description": "Provides infrastructure for SMT-enabled electronics assembly."
      }
    ],
    "specific": {},
    "metadata": {
      "inheritanceLevel": 3,
      "confidenceScore": 0.96,
      "sourceReference": "semiconductor industry reports",
      "createdAt": "2026-06-06T10:20:00Z",
      "auditTrail": [
        {
          "reviewDate": "2026-06-06",
          "reviewNote": "Infrastructure entry validated"
        }
      ]
    },
    "references": [
      {
        "title": "Semiconductor Fabrication Overview",
        "link": "https://example.org/fab",
        "description": "Overview of chip manufacturing plants."
      }
    ]
  },
  {
    "id": "N6",
    "name": "Global Smartphone Market",
    "tags": [
      "market",
      "smartphones",
      "economics",
      "price formation",
      "demand aggregation",
      "competition structure",
      "consumer electronics",
      "global trade"
    ],
    "layer": "Economic",
    "category": "Industry",
    "description": "Global economic market for smartphones.",
    "longDescription": "Represents global supply-demand dynamics, pricing structures, competition, and consumer adoption patterns for smartphones.",